{"schema_version":1,"id":"intent-retirement","description":"Retiring an intent does not remove resources still owned by another active intent.","requires":["linurad"],"steps":[{"name":"control-daemon-present","command":"command -v linurad >/dev/null"},{"name":"cli-present","command":"command -v linuractl >/dev/null"}]}
