{"schema_version":1,"id":"firstboot-offline","description":"First boot remains usable without a model provider or network.","requires":["linura-firstboot"],"steps":[{"name":"disable-network","command":"sudo systemctl stop NetworkManager.service || true"},{"name":"verify-cli","command":"linuractl version"},{"name":"verify-firstboot-contract","command":"test -f /usr/share/linura/firstboot.contract || true"}]}
